,Unnamed: 0,A,date,C,D,content,polarity
443,443,255710797869760512,2012-10-09 16:46:19,0,0,"I posted 5 photos on Facebook in the album ""Book Donation From Reader to Reader | Donacion de Libros"" http://t.co/lc5Df7z5",1
444,444,253744483731116032,2012-10-04 06:32:53,0,0,"@commonworks Is #commonpitchchile still happening? A little late to the game in stumbling across you folks, but hungry for more info",1
445,445,253666837286490112,2012-10-04 01:24:21,0,0,Check out VSP kids and volunteers shredding 10K races instead of waves this past weekend: http://t.co/wjNRUTuN,1
446,446,253149250924466176,2012-10-02 15:07:39,0,0,La cena antes de la corrida/ Dinner before the run! http://t.co/3qHnuaiv,1
447,447,251831326443978754,2012-09-28 23:50:41,0,0,"POR FAVOR, TOMAN 3 MINUTOS PARA AYUDAR AL VSP GANAR $10,000 USD! QUEDAN HORAS PARA VOTAR, POR FAVOR AYUDAN Y... http://t.co/NVx1fXg3",1
448,448,251822829992026112,2012-09-28 23:16:55,0,1,"RT @sam_rigby: Help out my dear, dear friends @valposurf with a quick vote (Vota)  here: http://t.co/7Mqh1Uu7",1
449,449,251707969123778561,2012-09-28 15:40:31,1,1,"HOY ES EL ULTIMO DIA PARA PARTICIPAR. POR FAVOR, TOMA 3 MINUTOS PARA AYUDAR LOS ESTUDIANTES DEL VSP. Y COMPARTE... http://t.co/sSuRLQEY",1
450,450,251001816567906304,2012-09-26 16:54:31,0,0,http://t.co/yhnVFxo3 photos/write-up of our NYC event. thanks to all who attended/supported. it was a blast!,1
451,451,248550600172785664,2012-09-19 22:34:15,0,0,How many boards do you see?  Cuantas tablas hay? http://t.co/TSc6MFLS,0
452,452,248549331995590656,2012-09-19 22:29:13,0,0,"Celebrating Chilean Independence, VSP Style  Celebrando la Independencia de Chile en la Casa VSP http://t.co/YGH3mqUb",0
453,453,248462596909453313,2012-09-19 16:44:33,0,0,Thanks to everyone who made the 4th Annual NYC Silent Auction Fundraiser a success!  A huge thanks to Patrick... http://t.co/DIKRAuqg,1
454,454,248459602352537600,2012-09-19 16:32:40,0,0,"I posted 44 photos on Facebook in the album """" http://t.co/85eUhvwb",1
455,455,248418318829117440,2012-09-19 13:48:37,0,0,Cada colilla puede contaminar hasta 50 litros de agua.  Por favor cuiden la playa.  ¡Felices fiestas patrias! http://t.co/tie91j9X,0
456,456,247008865479176192,2012-09-15 16:27:57,0,0,Tickets on sale until 5 PM today:  http://t.co/CaDW2jMO http://t.co/y1iR81N5,1
457,457,245183277168738304,2012-09-10 15:33:43,0,2,The 4th Annual NYC Silent Auction Fundraiser is coming up this Saturday! Tickets available at... http://t.co/el5it1wa,1
458,458,243753873553121281,2012-09-06 16:53:46,0,0,Come to the 4th Annual NYC Silent Auction Fundraiser next Saturday September 15 to bid on this beauty of a board... http://t.co/DBZPFzHz,1
459,459,242802521087803392,2012-09-04 01:53:26,0,1,Come support the VSP by attending the 4th Annual NYC Silent Auction Fundraiser on September 15th.  Featuring... http://t.co/k73IvXBS,1
460,460,238768215122132992,2012-08-23 22:42:33,1,1,"Join us for the 4th Annual NYC Fundraiser and Silent Auction When: Saturday, September 15, 7 PM-11 PM Where:... http://t.co/288fmLCY",1
461,461,238304537008537600,2012-08-22 16:00:03,0,2,RT @wearebrainstorm: Brainstorm in Chile - The Video! has been released. Check out our Chilean screen printing workshop adventure.  http ...,1
462,462,238295649219670016,2012-08-22 15:24:44,0,0,Here's a video from our buds at Brainstorm Print &amp; Design from their trip and screen printing workshops for VSP... http://t.co/MiiMLvX6,0
463,463,233950888652328960,2012-08-10 15:40:13,0,0,Thanks to Millalobo and their customers for collecting and donating these boards!  Gracias por las tablas... http://t.co/rswc7yCQ,1
464,464,233949650158239744,2012-08-10 15:35:17,0,0,This past Sunday...  El domingo pasado... http://t.co/y6uRvtdu,0
465,465,233948555616858113,2012-08-10 15:30:56,0,0,This past Sunday...  El domingo pasado... http://t.co/PnJSHjyS,0
466,466,227745751336357888,2012-07-24 12:43:13,0,0,http://t.co/pJvLDjrF  Votan para los directores de VSP en el... http://t.co/3JQlNQ5T,1
467,467,227461891000262657,2012-07-23 17:55:15,0,0,VSP alumna Cote visits with her old teacher while on leave from  the Naval Academy  Una ex alumna del VSP... http://t.co/Ao5g2Ojt,0
468,468,226370331219218432,2012-07-20 17:37:47,0,0,A couple young shredders getting ready for their first point break.  Un par de mini surfistas preparando para su... http://t.co/YTFE8Z1l,1
469,469,223863806223327232,2012-07-13 19:37:45,0,0,In English class we have been working on and presenting family tree diagrams.   En la clase de Inglés hemos... http://t.co/P6E4zX5k,1
470,470,223434907572109312,2012-07-12 15:13:27,0,0,So many students! A photo from an English class last week.  ¡Tantos estudiantes! Una foto de la clase de Inglés... http://t.co/GbOnWONI,1
471,471,223082134204715009,2012-07-11 15:51:40,0,0,Every 15 seconds this amount of plastic trash gets dumped into the ocean.  Makes you think twice about single use... http://t.co/2ZKsv1k5,1
472,472,222729955887431681,2012-07-10 16:32:14,0,1,"I posted 14 photos on Facebook in the album ""Director and Volunteer Sessions '12"" http://t.co/cPCqPjMg",1
473,473,217683154952134659,2012-06-26 18:18:03,0,0,http://t.co/Qpj6OKDX fun little animated short to pass your tuesday afternoon,1
474,474,217680462645170176,2012-06-26 18:07:21,0,0,"website is undergoing maintenance while we switch servers, be sure to keep up with us on http://t.co/Mc8ndA69 and thanks for bearing with us",1
475,475,200966465938132992,2012-05-11 15:11:53,0,2,VSP team with Pichilemu's Audiovisuales Gota check their new trailer for Complices https://t.co/vVK2EgSg http://t.co/8PU07xkw,1
476,476,198129094339211264,2012-05-03 19:17:11,0,0,A huge thanks to @AWarmCurrent for the donated booties and wetsuits. Kids are stoked. Check out more photos and info: http://t.co/mUwZhigR,1
477,477,197782656585449473,2012-05-02 20:20:34,0,2,"Check out the article published in @DriftSurf by @mfearon4 Melissa Leiter: http://t.co/qsK29X8b. Great stuff folks, thanks to both of you.",1
478,478,197781030961283072,2012-05-02 20:14:07,0,1,RT @DriftSurf: New post: Creating a surfing community http://t.co/4EdxvHwb,1
479,479,196301704269021185,2012-04-28 18:15:48,0,1,"39 bags of trash, and 4 of recyclable plastic s and bottles collected at Playa Portales today w/ @ValpoInterviene @GeoCiclos",1
480,480,196301164092993538,2012-04-28 18:13:39,0,1,"Little late for #oceanhour, but collected 39 bags of trash and 4 of recyclable glass &amp; plastics in Chile today @motherocean @quiksilverUSA",1
481,481,196296582809919488,2012-04-28 17:55:27,0,1,"39 bags of trash, 3 bags of recyclable glass, and 4 of recyclable plastic collected at Playa Portales today w/ @ValpoInterviene @GeoCiclos",1
482,482,195954187719294976,2012-04-27 19:14:53,0,0,More photos of the kids playing darth vader   with their respirators while glassing the first surfboard they shaped http://t.co/lBO8phiO,1
483,483,195943319170334721,2012-04-27 18:31:42,0,0,Great read from the WSJ about @patagonia founder and all around inspiring guy Yvon Chouinard: http://t.co/Bq6R9HnG,1
484,484,195303806593011712,2012-04-26 00:10:30,0,2,RT @Chilesurf: Alerta Amarilla #Quiksilver #Ceremonial 2012 | @ChileSurf #surf @surfnavarro http://t.co/C7tnL5gQ http://t.co/uWYIFyKr,1
485,485,195174438390611968,2012-04-25 15:36:26,0,1,RT @sam_rigby: Great video profile of @valposurf from one of their volunteers: http://t.co/WWVRAoFh. So proud of you boys.,1
486,486,195163591324864512,2012-04-25 14:53:20,0,0,Great video from volunteer Ryan Alberto who spent a month in March working with the VSP http://t.co/RXLuQkfa.  Looks  great!,1
487,487,194558904536014848,2012-04-23 22:50:32,0,1,Beach clean this Saturday at Playa Portales with @valpointerviene and @geociclos. Come lend a hand! http://t.co/gqQQARMD,0
488,488,193852468596187136,2012-04-22 00:03:24,0,1,"First VSP collabo board.  Thanks to all who had a hand in it-students, shapers, and glassers. Mas photos soon. http://t.co/ykYYjX7o",1
489,489,186814561293316096,2012-04-02 13:57:16,0,2,Photos finally up of @wearebrainstorm getting dirty with 3 silkscreening workshops for our students in Valpo http://t.co/LpcNQl29,1
490,490,186203946644279296,2012-03-31 21:30:55,0,2,"Good luck to our friend Hamish Wood, running the Santiago Marathon tomorrow, with matched donations from @AimiaInc . Suerte Hamish!",1
491,491,179672837689315328,2012-03-13 20:58:37,0,0,after a fun week of silk screening classes we're back to english lesson with the kids this week. hopefully they get some waves this weekend,1
492,492,179184383494848512,2012-03-12 12:37:40,0,0,great week with @wearebrainstorm. the kids loved the screen printing workshops. we need to get J&B back down to Chile ASAP. Thanks guys!,1
493,493,177382631967703040,2012-03-07 13:18:09,0,0,We're stoked for our screen printing with @wearebrainstorm this week. Estamos emocionados por nuestra clase con @wearebrainstorm este semana,1
494,494,176749496695402496,2012-03-05 19:22:18,0,0,It's SUPER MONDAY. Back to school for all the kids! We wish our students the best this year.,1
495,495,176749254231072768,2012-03-05 19:21:20,0,0,deseamos lo mejor por nuestros estudiantes quienes vuelven a clase hoy dia este SUPER LUNES despues de un buen verano.,1
496,496,176693902659686400,2012-03-05 15:41:23,0,1,"@gunsgermssteal the boards, wetsuits, and gear arrived safe and sound early this morning. thank you so much! will send photos soon.",1
497,497,170590837212852224,2012-02-17 19:29:59,0,7,"RT @ValpoInterviene: Favor RT ""Limpieza de Playa Portales Necesitamos de todos!!"" https://t.co/ppyseCeF @valposurf  sigamos difundiendo!!",0
498,498,164726538590355456,2012-02-01 15:07:21,0,2,RT @heylupita_com: Una nota sobre @valposurf project un proyecto que se la juega por Surf para Todos :) http://t.co/XKNh3CTK,1
499,499,157126481582100482,2012-01-11 15:47:27,0,1,Gracias a @ValpoInterviene por el taller ayer. Fotos pronto.,1
500,500,156802835147788289,2012-01-10 18:21:23,0,1,Valpo Interviene presentation today: how to make ecobricks-converting plastic bottles & bags to building materials http://t.co/XmAuBnJZ,1
501,501,152263466890170369,2011-12-29 05:43:34,0,1,Happy Holidays from the Valpo Surf Project - Please make a contribution and help serve at-risk youth in Chile http://t.co/xHjcdstK,1
502,502,149915712582979584,2011-12-22 18:14:25,0,2,"RT @KorduroyTV: This holiday season, you can play a role in the environment by RECYCLING the foam packaging from your new favorite... ht ...",1
503,503,149915311716573185,2011-12-22 18:12:50,0,0,Amazing waves and adventuring in Patagonia: http://t.co/m0EzLnIN. Thanks @kepaacero for the inspiration and infectious laughter.,1
504,504,147369823926632450,2011-12-15 17:37:58,0,0,Good to talk story with @AWarmCurrent last night. Looking forward to partnering & exchanging ideas in the future. Stoked for suits in 2012!,1
505,505,146351477844217856,2011-12-12 22:11:26,1,2,http://t.co/pHNz2j5H New video of the kids shaping a board in Pichi. Much thanks to Schiestl Chile Surf and @surfparadise01 for the support,1
506,506,146321489547886592,2011-12-12 20:12:16,0,0,photos up from the foto valpo fundraiser in portland last week. thanks to all who attended! http://t.co/AF7VjncD,1
507,507,144954165498617856,2011-12-09 01:39:00,0,1,The world's best at the world's best. // Los mejores del mundo en la mejor del mundo. http://t.co/9dVuMDac #vanstriplecrown,1
508,508,139431940368498690,2011-11-23 19:55:39,0,1,@Chilesurf Entrega una tabla vieja para donar a VSP y recibe 35% dscnta de tabla nueva de @millalobosurf http://t.co/Kkt2AM8G,1
509,509,137241218991144961,2011-11-17 18:50:31,0,0,Photos from the 3rd Annual NYC Silent Auction at @CroptoCup in BK http://t.co/85U9UlUM.  Thanks to all who made it such a great night.,1
510,510,137239538425794560,2011-11-17 18:43:50,0,0,New on the site-VSP students co-shape a board in Pichilemu w Schiestl Chile Surf Boards http://t.co/N8EQmfXs. Paint and glass coming soon.,1
511,511,134694323236241408,2011-11-10 18:10:03,0,0,"Cribbage Tourney this Saturday (11/12/11) to benefit FOTO VALPO. Loads of swag for winners. Billy's Tavern in Thomaston, ME at 6pm",1
512,512,127827887662448640,2011-10-22 19:25:18,0,0,"TONIGHT IN BROOKLYN - OUR ANNUAL FUNDRAISER FEAT. WORKS BY DION AGIUS, CHRIS BURKHARD, BRAINSTORM, AND MORE http://t.co/xJkC7jjw",1
513,513,125361646611873792,2011-10-16 00:05:20,0,1,In NYC? Come support the VSP's annual fundraiser @CroptoCup Oct 22-  http://t.co/Q4IwCwcW for details and tickets.,1
514,514,125361487429640194,2011-10-16 00:04:42,0,0,In NYC? Come support the VSP's annual fundraiser @CroptoCup Oct 22-http://tinyurl.com/3zqnth3 for details and tickets.,1
515,515,125360667753594880,2011-10-16 00:01:26,0,0,Thanks to @wearebrainstorm for this great poster design. http://t.co/uH0iQUlB,1
516,516,119446670286127104,2011-09-29 16:21:20,0,0,"Great clip from ""Lost Atlas"" in Chile w/ @julian_wilson @dusty_p and wade. Renaca gets some play from Kai and the boys http://t.co/D8LEHjVb",1
517,517,118848006811430912,2011-09-28 00:42:27,0,0,ahora pueden seguir ganador del billabong XXL y surfista profesional diego medina @medinaprosurfer - uno de los mejores surfistas de chile.,1
518,518,118847280911626242,2011-09-28 00:39:34,0,3,be sure to follow XXL winner and all around world class surfer diego medina @medinaprosurfer - one of the best surfers from chile.,1
519,519,118663420156452864,2011-09-27 12:28:58,0,0,NYC fundraiser Octover 22nd in Brooklyn. Details to follow. We're stoked to be hosting an event back in NYC.,1
520,520,112568700141453312,2011-09-10 16:50:44,0,0,First ever #FOTOVALPO fundraiser today at 3 pm in Thomaston.  Great silent auction with good food and drink.  Come join us on the pier!,1
521,521,108721140830183424,2011-08-31 02:01:54,1,1,"1st FOTO VALPO event coming up 9/10 at the SLIPWAY in Thomaston, ME. more info  here http://t.co/o1nuqS9 come out and support the program!",1
522,522,93085384518533120,2011-07-18 22:30:59,0,0,check out @surfnavarro latest project Los Buscagigantes.  Ramon is an excellent example of all Chilean surfing can be. http://t.co/JhHRzVH,1
523,523,93084169768407040,2011-07-18 22:26:10,0,0,thanks to all who attended the San Diego event.  we'll be kicking things off on the east coast soon enough. stay tuned.,1
524,524,83709440552992768,2011-06-23 01:34:20,0,0,great event in LA. thanks for all the support. down in north county for a few days - feel free to drop a line if you're in the area,1
525,525,81830498569175040,2011-06-17 21:08:05,0,0,"@surfline If in LA, come support the VSP's 2nd Annual Silent Auction benefit   http://t.co/Lx02W9z.",1
526,526,81105776613134336,2011-06-15 21:08:18,0,0,@sam_rigby thanks brah. talk to you soon.,1
527,527,80789186818478080,2011-06-15 00:10:17,0,0,"big fundraiser in LA this Saturday http://t.co/Lx02W9z - who's going to be there? art, drinks, light appetizers, music, and a great cause",0
528,528,80788795997425664,2011-06-15 00:08:44,0,0,@sam_rigby got any LA people you can send our way for the fundy this saturday? http://t.co/Lx02W9z,1
529,529,80788678850527232,2011-06-15 00:08:16,0,0,@wearebrainstorm the poster looks amazing. we just plastered it all over santa monica. the rest of LA will be thoroughly covered tomorrow.,1
530,530,74320602328088576,2011-05-28 03:46:27,0,0,Stoked to be in Pichilemu--good luck to @peter_mel @healeysurf @surfnavarro @CristianMerello and all the contestants in the Ceremonial.,1
531,531,58910031076270080,2011-04-15 15:10:20,0,0,Valpo Surf Project February-March '11 Newsletter - http://eepurl.com/dmLy6,1
532,532,58203442983874560,2011-04-13 16:22:36,0,0,Older group having a nuclear energy debate in English today. We're stoked to see what they come up with.  #Winning team gets elite prize.,0
533,533,58166549541949441,2011-04-13 13:56:00,0,0,http://bit.ly/gQfd4O great classroom photos - especially some good ones with our two VT Academy volunteers Ryan and Sierra,1
534,534,58166302770085888,2011-04-13 13:55:01,0,1,new surf shots up on site - http://bit.ly/efLZd8 - some good stuff of the kids,1
535,535,58166017226051584,2011-04-13 13:53:53,0,0,great event @SurfTaco thanks to all who came out to support us in NJ and thanks to @SurfTaco for hosting!,1
536,536,53180516723195904,2011-03-30 19:43:17,0,0,present http://twitpic.com/4f25pv at any @SurfTaco location TODAY and 20% of the check goes the @valposurf #Vanpaign  http://bit.ly/fNRYFl,1
537,537,53179462551998466,2011-03-30 19:39:06,0,0,surf taco fundraiser TODAY at all surf taco locations in NJ. don't forget to bring this flyer with you!!!!! http://twitpic.com/4f25pv,1
538,538,51634418850332672,2011-03-26 13:19:39,0,0,surf session with the kids tomorrow. hopefully the swell chills out a bit - it doesn't take much for it to be overhead for an 8 year old,1
539,539,48877916452429825,2011-03-18 22:46:18,0,0,A huge thanks to everyone at @KorduroyTV  for the awesome article.  Go here to read the whole thing http://tinyurl.com/4lekm9z,1
540,540,47674911828885504,2011-03-15 15:05:59,0,2,RT @surfline: great service project! RT @valposurf: The #vanpaign- http://bit.ly/ghqlWL go here to help keep our kids surfing - http://b ...,1
541,541,47674747357642753,2011-03-15 15:05:20,0,1,RT @sam_rigby: More Bates peeps doing tings: @valposurf's #vanpaign in @surfingmagazine: http://t.co/XW51fXa,1
542,542,47469326386741249,2011-03-15 01:29:04,0,0,The #vanpaign on @surfline - http://bit.ly/ghqlWL - thanks for the support. go here to help keep our kids surfing - http://bit.ly/fNRYFl,1
543,543,47419557727571968,2011-03-14 22:11:18,0,1,thanks for @surfingmagazine for helping out with the #vanpaign !! all of us at the VSP truly appreciate the support. http://bit.ly/glJv88,1
544,544,46366224283738112,2011-03-12 00:25:43,0,0,clases de surf estan suspendidos hasta que se baja la alerta de tsunami - surf clases suspended until the tsunami alert is dropped.,1
545,545,46165203578142720,2011-03-11 11:06:56,0,0,Thoughts go out to Japan/Hawaii. Staying dry in Chile until further notice. Check the Japan tsunami footage http://tinyurl.com/685bgyt,1
546,546,46158122095616000,2011-03-11 10:38:48,0,1,"RT @glasspichilemu: Terremoto 8.9 en Japon podria generar tsunami en Chile,atento Juan Fernandez y Rapa Nui http://www.onemi.cl/html/not ...",1
547,547,45895474712023040,2011-03-10 17:15:08,0,2,RT @wileytodd: @valposurf launches the #vanpaign a campaign to raise $ for a new van - support with a RT or better yet a contribution ht ...,1
548,548,45887941880459265,2011-03-10 16:45:12,0,0,Present this flier at any @surftaco location on March 30 and 20% of the bill goes to benefit the Vanpaign.   http://twitpic.com/486dqo,1
549,549,45670442060619778,2011-03-10 02:20:56,0,2,"VSP #Vanpaign, fundraising drive for a new van, is live. Check out how you can help at http://tinyurl.com/4ht82wg http://twitpic.com/47zedf",0
550,550,44898024002031616,2011-03-07 23:11:37,0,0,The governor of the 5th region of Chile visited the VSP with school supplies for the kids. Visita del Gobernador. http://bit.ly/fPZHL5,1
551,551,44897304989274113,2011-03-07 23:08:46,0,0,"El VSP en La Tercera/The VSP in one of Chile's largest newspapers - with a great photo of @wileytodd, Diego, and Henry http://bit.ly/i6azpN",1
552,552,44895590420721664,2011-03-07 23:01:57,0,0,"Big beach clean we did at our local spot in Feb, the kids did a great job! Un gran limpieza de playa hicimos en febrero http://bit.ly/fk2sMp",1
553,553,44894690260156416,2011-03-07 22:58:22,0,0,Some photos of the kids surfing in Dec & Jan - Los cabros chicos surfeando en Diciembre y Enero http://bit.ly/gkUG0V,1
554,554,44892610799742976,2011-03-07 22:50:07,0,0,sites back (it's been back) and the VSP twitter is returning with regular updates from the bottom of the globe.,1
555,555,30698500136108032,2011-01-27 18:47:47,0,0,The Valpo Surf Project website is currently under going maintenance. Please bear with us while we work out the bugs. Thank You!,1
556,556,24443472912056320,2011-01-10 12:32:32,0,0,"@julian_wilson Where you headed in Chile?  If you and the lost atlas boys are in Valparaiso, hit us up for some spots/to check the program.",1
557,557,20477900222365697,2010-12-30 13:54:46,0,0,Bringing beach cleans closer to home w/ community service project Limpiando Mi Barrio. Photos and info: http://tinyurl.com/25tq5ok,1
558,558,12717535296233472,2010-12-09 03:57:51,0,0,Valpo Surf Project December Newsletter - http://eepurl.com/bLjEz,1
559,559,10825490583519232,2010-12-03 22:39:32,0,0,@valposurf @VANS_CHILE Filson collabo.  #viernesvans,1
560,560,10821273319903232,2010-12-03 22:22:47,0,0,@VANS_CHILE Demasiado facil. #viernesvans,0
561,561,10816335395160064,2010-12-03 22:03:09,0,0,@Liquiddreams @xcel_wetsuits 1st time surf sesh for our 8-11 year olds tomorrow-time for tiny suits. Thanks LDS.  http://twitpic.com/3cla9z,1
562,562,9275884565438465,2010-11-29 16:01:57,1,0,http://tinyurl.com/2fw9vdd Vote for #RamonNavarro in this video challenge.,1
563,563,4938033036009473,2010-11-17 16:44:53,0,0,New updates to website http://tinyurl.com/32p5rdz and FB http://tinyurl.com/2wlv3em Surf pics up soon!,1
564,564,4291371607261184,2010-11-15 21:55:17,0,1,RT @glasspichilemu: Ramon Navarro considerado entre los diez mejores surfistas de olas grandes segun el LaTimes mas info en www.glass.cl,1
565,565,4274374764929024,2010-11-15 20:47:45,0,49,"RT @Rob_Machado: help get @kellyslater on the cover of @SI_24Seven and @ESPNmag, http://ow.ly/3a8jb",1
566,566,4251985742143488,2010-11-15 19:18:47,0,0,First surf session of the season with the kids yesterday. Great waves and weather. Mas fotos pronto. http://twitpic.com/375u6u,1
567,567,2112597293801472,2010-11-09 21:37:37,0,0,"After months of waiting on the IRS, Valpo Surf Project, Inc. now has 501c3 tax exempt status.  So stoked.",1
568,568,1685880632770560,2010-11-08 17:21:59,0,0,1st surf session of the season was rained out yesterday. Surf flicks on the big screen--not a bad backup plan. http://twitpic.com/353fhx,1
569,569,1683693236125696,2010-11-08 17:13:18,0,0,http://twitpic.com/353fhx 1st surf session of the season was rained out yesterday. Surf flicks on the big screen--not a bad backup plan.,1
570,570,1032932672147457,2010-11-06 22:07:24,0,0,Congratulations to #KellySlater on winning his 10th world title.  Huge feat.,1
571,571,29511866849,2010-11-02 22:31:26,1,0,We here at the VSP are shocked and deeply saddened by the loss of #AndyIrons,1
572,572,29311028350,2010-10-31 21:14:18,0,0,"Great event in Thomaston, ME on Thursday. Thank you to all who attended! Happy Halloween.",1
573,573,28835401002,2010-10-26 23:17:42,0,0,Maine event this Thursday! http://bit.ly/ayjmZn,1
574,574,28418034658,2010-10-22 16:03:40,0,0,Chile's been pumping with 15 ft + swell. Great! but... we need to get the kids back in the surf after a long winter of studying and swimming,1
575,575,27852404283,2010-10-19 17:15:12,0,1,RT @ManoolaTakeTwo: @valposurf coverage!!! http://manuelasays.com/post/1348008178/valpo-surf-project-the-sexiest-ngo,1
576,576,27852400007,2010-10-19 17:15:08,0,1,RT @ManoolaTakeTwo: @valposurf thanks for a really fun event! im gonna write a blog post on it tonite,0
577,577,27852391690,2010-10-19 17:15:03,0,1,RT @sam_rigby: Awesome: my boys @valposurf are on Surfline! http://www.surfline.com/id/?id=48752,1
578,578,27768842115,2010-10-18 20:59:54,0,1,great weekend @ManoolaTakeTwo thanks for bringin 'em out to the event. we'll see you when we see you!,1
579,579,27462882258,2010-10-15 17:31:37,0,1,Over 50 pieces up for auction and gift certificates t-shirts and other swag being given away for door prizes. 7-9 pm All to benefit the kids,1
580,580,27462766915,2010-10-15 17:30:09,0,2,NYC Silent Auction today. See you there. Save $5 on the entry fee by getting your tickets in advance here - http://bit.ly/cKoNPK,1
581,581,27395121168,2010-10-15 01:10:32,0,1,Awesome NYC event tomorrow. Be prompt if you can - we're wrapping things up around 9. http://bit.ly/dxKJff - http://bit.ly/cKoNPK,1
582,582,27390644065,2010-10-15 00:16:24,0,0,yo @imsalmasekela we met @wearestoked awards. saw you're in nyc. check out our fundy @Saturdaysnyc  tomorrow if you can http://bit.ly/dxKJff,0
583,583,26954923191,2010-10-10 17:18:31,0,2,Get tickets for the NYC event @saturdaysnyc http://bit.ly/bNtLtK More info FB invite http://on.fb.me/9rjJvC Event flyer http://bit.ly/dxKJff,1
584,584,26303442342,2010-10-03 21:44:36,0,0,Thanks for showing your love at the Jersey fundraiser.  It was a blast. New York next.  The grand finale will be a blowout.  Don't miss it!,1
585,585,26080856987,2010-10-01 13:47:06,0,0,"Jersey fundraiser TOMORROW - Around? Hit us up. Surf vids, booze, and grill to help get kids surfing and studying. http://bit.ly/9P8aoz",1
586,586,25431099588,2010-09-24 19:09:44,0,1,Thanks to all who came out to the Boston fundy.  NJ is on Oct 2nd and NY is Oct 15. Details coming. Stay tuned.,1
587,587,23937406540,2010-09-08 18:28:27,0,1,Boston Fundraiser Sept. 15th @McFaddensBoston event info on vsp site http://bit.ly/c4woYF or facebook http://bit.ly/cK4lx8,1
588,588,20919921173,2010-08-11 21:56:52,0,0,New ASP format confirmed - maybe this'll be the format one of our little ones will be competing under some day? No Chilean on the WT yet...,1
589,589,20807306991,2010-08-10 16:24:41,0,1,Thanks a ton to @capital_cause for a great DC fundraiser. And thank you to all the people who came out to support all the great causes!,1
590,590,20003335677,2010-07-31 16:34:03,0,1,VSP DC FUNDY TODAY! http://www.facebook.com/home.php?#!/event.php?eid=140314192646639&ref=mf,1
591,591,18141759436,2010-07-09 19:21:16,0,1,BE SURE TO CHOOSE THE VSP!!!  official DC event page - http://bit.ly/cT56wR facebook - http://bit.ly/awuFZd eventbrite -http://bit.ly/awuFZd,1
592,592,18140626187,2010-07-09 19:01:50,0,1,DC fundraiser July 31st - in participation with @capital_cause stoked to be trying something new. come out to support and spread the word!,1
